<?xml version="1.0" encoding="UTF-8"?>
<simpleSchedule xmlns="urn:ccsds:schema:cssm:1.0.0"
					 xmlns:xsi="http://www.w3.org/2001/XMLSchema-instance"
					 xmlns:xmi="http://www.omg.org/XMI"
					 xsi:schemaLocation="urn:ccsds:schema:cssm:1.0.0 902x01b1TC1-SmplSchd.xsd" >
	<simpleScheduleHeader originatingOrganization="RKPNI"
								 generationTime="2016-307T13:46:48.247Z"
								 status="TEST"
								 inclusionType="OVERLAP_INCLUSION"
								 version="1"
								 startTime="2016-134T00:00:00.000Z"
								 endTime="2016-164T00:00:00.000Z"
								 purpose="Purpose of the schedule."
								 description="Schedule description."/>
	<scheduledPackage scheduledPackageId="EVENT-2015.190.11.41.47.243348-821429"
							user="GAIA"
							originatingRequestId ="GAIA_Dummy_Request_001">
		<servicePackageXRef serviceAgreementRef="GAIA_Routine_1.daily_TTC.nominal_definition.GAIA"
								  servicePackageRef="EVENT-2015.190.11.41.47.243348-821429"/>
		<scheduledActivity scheduledActivityId="EVENT-2015.190.11.41.47.243348-821429"
								 activityStatus="COMMITTED"
								 siteRef="MLG"
								 apertureRef="MLG"
								 beginningOfActivity="2016-134T02:47:52.000Z"
								 beginningOfTrack="2016-134T03:32:52.000Z"
								 endOfTrack="2016-134T10:10:29.000Z"
								 endOfActivity="2016-134T10:25:29.000Z">
			<serviceInfo	serviceType="TELEMETRY"
							frequencyBand="X-DS" >
			</serviceInfo>
		</scheduledActivity>
	</scheduledPackage>
	<scheduledPackage scheduledPackageId="EVENT-2015.190.10.48.15.165576-808510"
							user="LIPF"
							originatingRequestId ="LIPF_Dummy_Request_001">
		<servicePackageXRef serviceAgreementRef="Lisa_Pathfinder_1.daily_TTC.nominal_definition.LIPF"
								  servicePackageRef="EVENT-2015.190.10.48.15.165576-808510"/>
		<scheduledActivity scheduledActivityId="EVENT-2015.190.10.48.15.165576-808510"
								 activityStatus="COMMITTED"
								 siteRef="CEB"
								 apertureRef="CEB"
								 beginningOfActivity="2016-134T05:15:00.000Z"
								 beginningOfTrack="2016-134T06:00:00.000Z"
								 endOfTrack="2016-134T14:00:00.000Z"
								 endOfActivity="2016-134T14:15:00.000Z">
			<serviceInfo	serviceType="TELEMETRY"
							frequencyBand="X-DS" >
			</serviceInfo>
		</scheduledActivity>
	</scheduledPackage>
	<scheduledPackage scheduledPackageId="EVENT-2015.190.13.59.48.510482-846702"
							user="ROS"
							comment="This is an example of an optional comment for a scheduled package..."
							originatingRequestId ="ROS_Dummy_Request_001">
		<servicePackageXRef serviceAgreementRef="ROSETTA_Routine_2.Continuous_TTC.nominal_definition.ROS"
								  servicePackageRef="EVENT-2015.190.13.59.48.510482-846702"/>
		<scheduledActivity scheduledActivityId="EVENT-2015.190.13.59.48.510482-846702"
								 activityStatus="COMMITTED"
								 siteRef="NNO"
								 apertureRef="NNO"
								 beginningOfActivity="2016-134T06:36:08.000Z"
								 beginningOfTrack="2016-134T07:21:08.000Z"
								 endOfTrack="2016-134T16:05:48.000Z"
								 endOfActivity="2016-134T16:20:48.000Z">
			<serviceInfo	serviceType="TELEMETRY"
							frequencyBand="X-DS" >
			</serviceInfo>
		</scheduledActivity>
	</scheduledPackage>
	<scheduledPackage scheduledPackageId="TEST-SC1_Scheduled_Package_001"
							user="TEST-SC1"
							originatingRequestId ="TEST-SC1_Dummy_Request_001">
		<servicePackageXRef serviceAgreementRef="TEST-SC1_Service_Agreement"
								  servicePackageRef="TEST-SC1_Service_Package_001"/>
		<scheduledActivity scheduledActivityId="TEST-SC1_Schedule_Activity_001"
								 activityStatus="TENTATIVE"
								 siteRef="NNO"
								 apertureRef="NNO"
								 beginningOfActivity="2016-136T16:00:00.000Z"
								 beginningOfTrack="2016-136T17:16:30.000Z"
								 endOfTrack="2016-136T22:00:00.000Z"
								 endOfActivity="2016-136T22:30:00.000Z">
			<serviceInfo	serviceType="TELEMETRY"
							frequencyBand="X-DS" >
			</serviceInfo>
			<serviceInfo	serviceType="TELECOMMAND"
							frequencyBand="X-DS" >
			</serviceInfo>
		</scheduledActivity>
	</scheduledPackage>
	<scheduledPackage scheduledPackageId="TEST-SC2_Scheduled_Package_001"
							user="TEST-SC2"
							originatingRequestId ="TEST-SC2_Dummy_Request_001">
		<servicePackageXRef serviceAgreementRef="TEST-SC2_Service_Agreement"
								  servicePackageRef="TEST-SC2_Service_Package_001"/>
		<scheduledActivity scheduledActivityId="TEST-SC2_Schedule_Activity_001"
								 activityStatus="TENTATIVE"
								 siteRef="NNO"
								 apertureRef="NNO"
								 beginningOfActivity="2016-136T17:00:00.000Z"
								 beginningOfTrack="2016-136T17:30:00.000Z"
								 endOfTrack="2016-136T23:00:00.000Z"
								 endOfActivity="2016-136T23:30:00.000Z">
			<serviceInfo	serviceType="TELEMETRY"
							frequencyBand="X-DS" >
			</serviceInfo>
		</scheduledActivity>
	</scheduledPackage>
	<scheduledPkgAssn associationId = "Association_TEST-SC1_Schedule_Package_001_and_TEST-SC2_Schedule_Package_001"
						 associationKind = "MSPA"
						 comment = "MSPA pass on New Norcia for TEST-SC1 and TEST-SC2" >
						 <scheduledPackageIdRef ref="TEST-SC1_Scheduled_Package_001" />
						 <scheduledPackageIdRef ref="TEST-SC2_Scheduled_Package_001" />
						 <externalSchedPkgIdRef ref="This_is_an_example_of_a_reference_to_an_external_Scheduled_Package_i.e._One_that_is_not_contained_in_the_same_XML_file" />
	</scheduledPkgAssn>
	</simpleSchedule>